id,character,source,translatedstr
workchr_0101_B_01_00_007(0),Ｐ,"ああ。種目もいろいろあるし、
春香に合う競技もあるはずだぞ",
workchr_0101_B_01_00_008(0),春香,"……嬉しいです！　あの、プロデューサーさんから
見て、私に向いていそうな競技って、ありますか？",
workchr_0101_B_01_00_009(0),Ｐ,"春香に向いていそうな競技か。
そうだな、予定されている種目から選ぶなら……",
workchr_0101_B_01_00_010(0),選択肢,障害物競走,
workchr_0101_B_01_00_011(0),選択肢,パン食い競争,
workchr_0101_B_01_00_012(0),選択肢,飴食い競争,
workchr_0101_B_01_00_013(0),選択肢,徒競走,
workchr_0101_B_01_00_014(0),Ｐ,"障害物競走はどうだ？　何もないところで転ぶなら、
逆に何かある場所なら転ばないんじゃないか？",
workchr_0101_B_01_00_015(0),春香,"え、ええっ！？
そ、そういうものなんでしょうか？",
workchr_0101_B_01_00_016(0),Ｐ,"確証はないが、試してみる価値はある。
どうだ？　挑戦してみないか？",
workchr_0101_B_01_00_017(0),春香,"プロデューサーさん……。そうですよね、
何事もチャレンジが大事、ですよねっ！",
workchr_0101_B_01_00_018(0),春香,"それじゃあ私、思い切って挑戦してみます！
プロデューサーさんも、見守っててくださいね♪",
workchr_0101_B_01_00_019(0),春香,"わ、私が１位……！？　プロデューサーさんの
言う通り、転ばずにゴールできちゃいました♪",
workchr_0101_B_01_00_020(0),Ｐ,"（リハーサルで見事な走りを見せた春香。
本番でも大健闘をして、チームを優勝に導いた！）",
workchr_0101_B_01_00_021(0),Ｐ,"パン食い競争はどうだ？　転んでも、素早くパンを
取れれば、充分巻き返しができる",
workchr_0101_B_01_00_022(0),春香,"な、なるほど……！　上手にパンが取れるかは
わからないですけど……私、頑張ります！",
workchr_0101_B_01_00_023(0),春香,"結局転んじゃいましたけど、パンもおいしかったし
とっても楽しかったです♪",
workchr_0101_B_01_00_024(0),Ｐ,"（一生懸命頑張る春香を見て、チームは団結した。
本番では一丸となって競技に挑むことができた！）",
workchr_0101_B_01_00_025(0),Ｐ,"飴探しはどうだ？　素早く飴を取れば、
ライバルたちにも差を付けられる",
workchr_0101_B_01_00_026(0),春香,"飴探し……！　そうですね、さっと取って
急いでゴールすれば、きっと大丈夫ですよね！",
workchr_0101_B_01_00_027(0),Ｐ,ああ、でも転んで粉をぶちまけないようにな,
workchr_0101_B_01_00_028(0),春香,"大丈夫ですよ、まかせてください！
あ、でも……飴って、どんな味の飴なのかな？",
workchr_0101_B_01_00_029(0),Ｐ,"（リハーサルで飴探しに夢中だった春香。
本番でもスピードをあげることはできなかった）",
workchr_0101_B_01_00_030(0),Ｐ,"いや、やっぱり逃げるのはよくないな。
このまま徒競走を頑張ろう！",
workchr_0101_B_01_00_031(0),春香,"そ、そうですよね……。わかりました、
チームのためにも、一生懸命頑張ります！",
workchr_0101_B_01_00_032(0),Ｐ,"（リハーサルで、最下位になってしまった春香。
それを引きずって、本番でも調子を出せなかった）",
workchr_0101_B_01_00_033(0),Ｐ,（今回の仕事は成功だ！）,
workchr_0101_B_01_00_034(0),Ｐ,（今回の仕事は失敗だ。次こそは！）,
workchr_0101_C_01_00_001(0),Ｐ,"（アイドル情報番組『ＴＯＰ×ＴＯＰ！』に、
ディレクターからの指名で春香が出ることになった）",
workchr_0101_C_01_00_002(0),Ｐ,"どうだ、春香。
もうすぐ収録が始まるが、準備はできてるか？",
workchr_0101_C_01_00_003(0),春香,"はいっ！　ディレクターさんからのご指名ですし、
気合いを入れないと、ですよねっ！",
workchr_0101_C_01_00_004(0),春香,"でも……プロデューサーさん、実はこの質問の
答えをどうしたらいいか、迷ってるんです",
workchr_0101_C_01_00_005(0),Ｐ,"ん？　これが質問リスト……。
『アイドルをやっている理由は？』……か",
workchr_0101_C_01_00_006(0),Ｐ,……なるほど、これは確かに少し難しい質問だな,
workchr_0101_C_01_00_007(0),春香,"そうなんです……。改めてそう聞かれると、
なんのためって選びきれなくて……",
workchr_0101_C_01_00_008(0),春香,私がアイドルをやっている理由……,
workchr_0101_C_01_00_009(0),Ｐ,"確かにそうだな……。
でも春香がなんのためにアイドルをするのか、か……",
workchr_0101_C_01_00_010(0),選択肢,笑顔,
workchr_0101_C_01_00_011(0),選択肢,歌,
workchr_0101_C_01_00_012(0),選択肢,自分,
workchr_0101_C_01_00_013(0),選択肢,俺,
workchr_0101_C_01_00_014(0),Ｐ,"やっぱりみんなの笑顔が見たいから、じゃないか？
春香はみんなの笑顔が好きだろ？",
workchr_0101_C_01_00_015(0),春香,"笑顔……。
……っ！　はい！　笑顔、好きです！",
workchr_0101_C_01_00_016(0),春香,"ありがとうございます、プロデューサーさん！
私、胸を張って笑顔だって答えてきますね♪",
workchr_0101_C_01_00_017(0),春香,"私がアイドルを続けるのは、
みんなの笑顔が見たいからです",
workchr_0101_C_01_00_018(0),春香,"だから私、これからもみんなを笑顔にするため、
アイドルとして、ステージに立ち続けたいです！",
workchr_0101_C_01_00_019(0),Ｐ,"（力強い春香の言葉に、スタジオからは拍手喝采。
アイドル、天海春香を象徴するような言葉だった）",
workchr_0101_C_01_00_020(0),Ｐ,"春香は歌が好きで、アイドルになったよな。
歌を歌いたくて……とかかな？",
workchr_0101_C_01_00_021(0),春香,"確かに、私がアイドルを目指したのは、歌が好きで
……今も、そこは変わりません。でも……",
workchr_0101_C_01_00_022(0),春香,"私が歌うと、みんな笑顔になってくれるから、今は、
もっと好きになりました！　それを伝えてみます！",
workchr_0101_C_01_00_023(0),春香,"私が歌うことでみんなが笑顔になってくれるから……
だから、アイドルを続けています！",
workchr_0101_C_01_00_024(0),Ｐ,"（春香の言葉に、スタジオからも感嘆の声が。
アイドルらしい姿に、頼もしさを感じた）",
workchr_0101_C_01_00_025(0),Ｐ,"ここはあえて自分のためだと言ってみるのはどうだ？
意外性が演出できるかもしれないぞ",
workchr_0101_C_01_00_026(0),春香,"自分のため、ですか？　うーん、それも
間違ってはいないと思いますけど……",
workchr_0101_C_01_00_027(0),春香,"でも、そうですね。
たまには強気でいくのも大切……なのかな？",
workchr_0101_C_01_00_028(0),Ｐ,"（自分のためと答えた春香に、スタジオも困惑。
強気にいく作戦は、今回は失敗だったようだ……）",
workchr_0101_C_01_00_029(0),Ｐ,"俺のため、とかどうだ！？　プロデューサーを
喜ばすためにアイドルをやる春香……。とかな！",
workchr_0101_C_01_00_030(0),春香,"ええ！？　プロデューサーさんのためって、ゼロでは
ないですけど、趣旨と違うような……いいのかなあ？",
workchr_0101_C_01_00_031(0),Ｐ,"（残念ながら番組の趣旨からずれていたようで、
この質問の場面はカットされることになった……）",
workchr_0101_C_01_00_032(0),Ｐ,（今回の仕事は成功だ！）,
workchr_0101_C_01_00_033(0),Ｐ,（今回の仕事は失敗だ。次こそは！）,
